patent_no,title,
6018296,Amorphous magnetostrictive alloy with low cobalt content and method for annealing same,
6017643,"Hot-dip aluminized steel sheet, method of manufacturing the same and alloy-layer control apparatus",
6017490,Pressed body of amorphous magnetically soft alloy powder and process for producing same,
6017488,Method for nitriding a titanium-based carbonitride alloy,
6017403,High strength and high rigidity aluminum-based alloy,
6017231,Card ejecting mechanism driven by a memory alloy wire,
6016981,Apparatus for producing hydrogen adsorption alloy,
6016096,Control module using shape memory alloy,
6013572,Methods of fabricating and testing silver-tin alloy solder bumps,
6013387,Hydrogen absorbing alloy for battery application,
6013161,"Thin film magnetic alloy having low noise, high coercivity and high squareness",
6011605,Liquid crystal display with a metallic reflecting electrode having a two layer film of Ti and Al alloy,
6011305,Semiconductor device having metal alloy for electrodes,
6010816,Aluminum alloy support for planographic printing plate,
6010661,"Method for producing hydrogen-containing sponge titanium, a hydrogen containing titanium-aluminum-based alloy powder and its method of production, and a titanium-aluminum-based alloy sinter and its method of production",
6010582,Process for producing hydrogen-occlusion alloy electrode of alkaline storage battery,
6010581,"Austenitic Ni-based alloy with high corrosion resistance, good workability and structure stability",
6010059,Method for ultrasonic joining of electrical parts using a brazing alloy,
6007923,"Titanium alloy, member made of the titanium alloy and method for producing the titanium alloy member",
6007871,Method of surface treatment for a fishing tackle part made of alloy steel containing chrome,
6007544,Catheter apparatus having an improved shape-memory alloy cuff and inflatable on-demand balloon for creating a bypass graft in-vivo,
6004408,Nickel-chrome-iron based alloy composition,
6004371,Titanium-based carbonitride alloy with controllable wear resistance and toughness,
6002047,Catalytic hydrogenation using amorphous metal alloy and a solvent under near-critical or super-critical conditions,
6001495,"High modulus, low-cost, weldable, castable titanium alloy and articles thereof",
6001195,Ti-Ni-based shape-memory alloy and method of manufacturing same,
6001193,Hard magnetic alloy compact and method of producing the same,
5998913,Spark plug with iridium-rhodium alloy discharge portion,
5997810,High-strength copper based alloy free from smutting during pretreatment for plating,
5997807,"Thin plate made of an Fe-Ni alloy for electronic parts, shadow mask and cathode-ray tube with the shadow mask",
5997663,Nickel-free copper alloy,
5996645,Aluminum alloy extruded square pipe excellent in axially compressive properties for automobile front side member,
5996471,"Aluminum alloy for internal-combustion piston, and aluminum alloy piston",
5993736,Lead-free tin-silver-based soldering alloy,
5993735,Gold-based alloy for bonding wire of semiconductor device,
5993576,Wear resistant wrought aluminum alloy and scroll of wear-resistant wrought aluminum alloy,
5993575,Method for fabricating randomly oriented aluminum alloy sputting targets with fine grains and fine precipitates,
5993572,"Thixocasting process, and thixocasting aluminum alloy material",
5993568,Soft magnetic alloy sheet having low residual magnetic flux density,
5993506,"Plate-crystalline tungsten carbide-containing hard alloy, composition for forming plate-crystalline tungsten carbide and process for preparing said hard alloy",
5992942,Covering for light-alloy rim vehicle wheels during extended transport,
5990011,Titanium aluminum alloy wetting layer for improved aluminum filling of damescene trenches,
5989723,Conductive polyester-based alloy sheet,
5989495,Aluminum alloy for use in castings,
5989491,Oxide dispersion strengthened heat resisting powder metallurgy alloy and process for producing the same,
5989364,Gold-alloy bonding wire,
5988262,Sputtering target of single crystal aluminum alloy and method for producing the same,
5987926,Mold made of cuproaluminum alloy for the manufacture of glass products,
5986169,Porous nickel-titanium alloy article,
5985427,Coated carbide alloy cutting member exhibiting excellent resistance against chipping,
5985211,Composition of zirconium alloy having low corrosion rate and high strength,
5985124,Nickel or nickel alloy electroplating bath and plating process using the same,
5985057,Method of fabricating hydrogen absorbing alloy electrode,
5985055,Copper alloy and process for obtaining same,
5985054,Age precipitation-containing rare earth metal-nickel alloy,
5985048,Method for developing an enhanced oxide coating on a component formed from stainless steel or nickel alloy steel,
5985046,Process for making clear coated aluminum alloy lighting sheet,
5984258,Method and apparatus for control of a shape memory alloy actuator for a fuel injector,
5981919,Method and apparatus for characterizing and controlling the heat treatment of a metal alloy,
5981863,Process of manufacturing thermoelectric refrigerator alloy having large figure of merit,
5981089,Ferrous alloy with Fe-Al diffusion layer and method of making the same,
5980841,Method for recovering reusable elements from rare earth-nickel alloy,
5980822,Leadless alloy for soldering,
5980821,Austenitic nickel-chromium-iron alloy,
5980722,"Plated aluminum alloy, cylinder block thereof, plating line and plating method",
5980660,Metal alloy mass for forming in the semisolid state,
5980657,Alloy for enhanced filling of high aspect ratio dual damascene structures,
5980656,Copper alloy with magnesium addition,
5980654,Oxidation-resistant Ti-Al containing alloy,
5980653,Nickel-copper-beryllium alloy compositions,
5980652,Rod-shaped or tubular amorphous Zr alloy made by die casting and method for manufacturing said amorphous Zr alloy,
5978432,"Dispersion fuel with spherical uranium alloy, and the fuel fabrication process",
5977620,Lead frame having a Ni-Mn alloy layer and a Pd layer,
5977560,Thin film transistor constructions with polycrystalline silicon-germanium alloy doped with carbon in the channel region,
5976709,"Aluminum alloy member, with insert provided therein, possessing improved damping capacity and process for producing the same",
5976641,A1 alloy films and melting A1 alloy sputtering targets for depositing A1 alloy films,
5976459,Method for compacting high alloy tool steel particles,
5976456,Method for producing aluminum alloy powder compacts,
5976278,"Corrosion resistant, drawable and bendable aluminum alloy, process of making aluminum alloy article and article",
5976274,Soft magnetic amorphous alloy and high hardness amorphous alloy and high hardness tool using the same,
5976214,Slide member of sintered aluminum alloy and method of manufacturing the same,
5976213,Titanium-based carbonitride alloy with improved thermal shock resistance,
5975039,Process for manufacturing valve seat made of sintered FE alloy and valve seat made of sintered FE alloy,
5973335,Semiconductor memory devices with amorphous silicon alloy,
5973283,Tearable membrane switch with resinous bounded silver-palladium alloy contacts,
5973070,Polyolefin alloy with improved surface hardness and scratch resistance,
5972289,"High strength, thermally stable, oxidation resistant, nickel-based alloy",
5972288,Composition of zirconium alloy having high corrosion resistance and high strength,
5972131,Ag-Cu alloy for a sliding contact,
5972071,Aluminum alloy for piston and method for producing piston,
5972070,"Sintered friction material, composite copper alloy powder used therefor and manufacturing method thereof",
5971258,Method of joining aluminum parts by brazing using aluminum-magnesium-lithium-filler alloy,
5970307,Sintering method for tungsten-nickel-manganese type heavy alloy,
5968450,Scandium containing hydrogen absorption alloy and hydrogen absorption electrode,
5968449,Iron base Si--Mn alloy or iron base Si--Mn--Ni alloy having good crushability and alloy powder thereof,
5968333,Method of electroplating a copper or copper alloy interconnect,
5968291,Hydrogen-absorbing alloy,
5968226,Process of making goethite or iron-based alloy particles,
5968225,Hydrogen storage alloy powder and an electrode comprising the same,
5967110,"Fe-based sintered alloy manufacturing process, Fe-based sintered alloy manufactured through thereof and bearing cap",
5966064,"Nanocrystalline alloy having excellent pulse attenuation characteristics, method of producing the same, choke coil, and noise filter",
5965294,Hydrogen absorbing alloy electrode,
5965193,Process for preparing a ceramic electronic circuit board and process for preparing aluminum or aluminum alloy bonded ceramic material,
5965052,Supplying method for molten alloy for producing amorphous alloy thin strip,
5965036,Microetching composition for copper or copper alloy,
5964968,"Rare earth metal-nickel hydrogen storage alloy, method for producing the same, and anode for nickel-hydrogen rechargeable battery",
5964966,Method of forming biaxially textured alloy substrates and devices thereon,
5964770,High strength medical devices of shape memory alloy,
5964120,Hot extrusion forging die for use in titanium alloy,
5963774,Method for producing cast alloy and magnet,
5962165,"Hydrogen-absorbing alloy, method of surface modification of the alloy, negative electrode for battery and alkaline secondary battery",
5962156,Nickel-metal hydride storage battery and alloy for configuring negative electrode of the same,
5961938,Method for recovering reusable elements from rare earth-iron alloy,
5961792,Method for making titanium or titanium-alloy substrate for magnetic-recording media,
5961753,Enhancement of mechanical properties for selective platinum group metal alloy systems by age hardening,
5961752,High strength Mg-Si type aluminum alloy,
5961749,Use of a brass alloy for sanitary pipes,
5961745,Fe Based soft magnetic glassy alloy,
5959062,Polymer alloy and a composition therefrom,
5958522,High speed thermal spray coating method using copper-based lead bronze alloy and aluminum,
5958333,Tin-silver-based soldering alloy,
5958331,Fe-Ni based alloy sheet having superior surface characteristic and superior etchability,
5958159,Process for the production of a superelastic material out of a nickel and titanium alloy,
5958158,"Method of manufacturing hot-worked elongated products, in particular bar or pipe, from high alloy or hypereutectoidal steel",
5958153,Fe-system amorphous metal alloy strip having enhanced AC magnetic properties and method for making the same,
5958152,Chromized heat-resistant alloy members and a process for the production thereof,
5956558,Fabrication method for tungsten heavy alloy,
5954897,"Die-casting aluminum base alloy for a bearing of ball joint apparatus, heat treatment thereof and ball joint apparatus using the same",
5954309,"Aluminum alloy bracket for fixing elastic mount, assembly of elastic mount and bracket, and method of producing the bracket by extrusion",
5952590,Sintered alloy having superb wear resistance and process for producing the same,
5951945,Hydrogen occluding alloy and electrode made of the alloy,
5951793,"Ni-Ti-Pd superelastic alloy material, its manufacturing method, and orthodontic archwire made of this alloy material",
5951789,Heat resisting alloy for exhaust valve and method for producing the exhaust valve,
5951757,Method for making silicon germanium alloy and electric device structures,
5951738,"Production of granules of reactive metals, for example magnesium and magnesium alloy",
5949003,High-temperature wear-resistant sintered alloy,
5948497,High stability silver based alloy reflectors for use in a writable compact disk,
5948354,"Ferrules for continuous castings of metal or metal alloy, in particular aluminum",
5948235,Tin-silver alloy plating bath and process for producing plated object using the plating bath,
5948179,Alloy used for production of a rare-earth magnet and method for producing the same,
5945226,"Chromium alloy plating film, plating method thereof and member covered with said film",
5945067,High strength corrosion resistant alloy,
5945066,Zinc-copper based alloy and castings made therefrom,
5945065,Method for wedge bonding using a gold alloy wire,
5944977,"Hydrogen-occluding alloy pretreatment method, pretreated hydrogen-occluding alloy, and nickel-hydrogen secondary battery employing the same as an anode",
5944923,Aluminum alloy sheet with excellent formability and method for manufacture thereof,
5944914,Aluminothermic mixture with ferrochromium alloy,
5943942,Copper-based alloy casting process,
5943545,Method of manufacturing a hydrogen-absorbing alloy for use in an alkali storage cell,
5942096,Method and apparatus for electro-depositing a metal or alloy coating onto one or both sides of a metal strip,
5942057,Process for producing TiAl intermetallic compound-base alloy materials having properties at high temperatures,
5941249,Distributed activator for a two-dimensional shape memory alloy,
5939651,Titanium-based alloy,
5939164,Aluminum alloy sheet for magnetic disk substrate aluminum alloy clad sheet for magnetic disk substrate and their manufacturing method,
5938862,Fatigue-resistant lead-free alloy,
5935722,Laminated composite of magnetic alloy powder and ceramic powder and process for making same,
5935350,Hardfacing method and nickel based hardfacing alloy,
5935349,Intermetallic nickel-aluminum base alloy and material formed of the alloy,
5935347,FE-base soft magnetic alloy and laminated magnetic core by using the same,
5932513,Container packed with powder of hydrogen absorbing alloy,
5932369,Hydrogen occluding alloy and electrode made of the alloy,
5932036,Method for manufacturing titanium alloy sheet,
5932034,"Method of producing hydrogen absorbing alloy powder, and electrode using hydrogen absorbing alloy powder produced by said method",
5930332,"Method for connecting a molybdenum-based alloy structure to a structure formed from a more ductile alloy, and related articles",
5929723,Surface acoustic wave apparatus having an electrode that is a doped alloy film,
5928442,Medium/high carbon low alloy steel for warm/cold forming,
5927345,Super-elastic alloy braid structure,
5925315,Aluminum alloy with improved tribological characteristics,
5925314,High ductility aluminum alloy and method for manufacturing the high ductility aluminum alloy,
5925313,Aluminum base alloy containing boron and manufacturing method thereof,
5925298,Method for reworking a multi-layer circuit board using a shape memory alloy material,
5922479,Brazing alloy and composite assembly joined by using the same,
5922472,Method for preparing pre-coated aluminum alloy articles and articles prepared thereby,
5922452,Titanium and/or titanium alloy sintered friction material,
5922442,Magnetic recording medium having a CoCr alloy interlayer of a low saturation magnetization,
5922276,Gold alloy for porcelain/metal dental restorations,
5922275,"Aluminum-chromium alloy, method for its production and its applications",
5922274,Titanium alloy having good heat resistance and method of producing parts therefrom,
5922150,Method of heat treating a cobalt-base alloy,
5922147,Method and apparatus for simplified production of heat-treatable aluminum alloy castings,
5922146,Hydrogen-absorbing alloy of ultra high capacity for electrode of secondary battery,
5920760,Coated hard alloy blade member,
5919577,Fe-based alloy foil for liquid-phase diffusion bonding of Fe-based materials by enabling bonding in oxidizing atmospheres,
5919323,Corrosion resistant aluminum alloy rolled sheet,
5919322,"Alloy, in particular for use in the manufacture of frames for glass, jewelry, and the like",
5919320,Nickel-free white gold alloy with reversible hardness characteristics,
5919319,"Iron-cobalt alloy, process for manufacturing a strip made of iron-cobalt alloy, and strip obtained",
5918795,"Soldering alloy, cream solder and soldering method",
5918103,"Plate-crystalline tungsten carbide-containing hard alloy, composition for forming plate-crystalline tungsten carbide and process for preparing said hard alloy",
5917198,Gate electrodes and matrix lines made of W/Ta alloy for LCD apparatus,
5916519,Hydrogen storage alloy containing iron,
5916517,Nitrogen-bearing iron-based alloy for machine parts subject to sliding friction,
5916390,Cylinder liner comprising a supereutectic aluminum/silicon alloy for sealing into a crankcase of a reciprocating piston engine and method of producing such a cylinder liner,
5916386,Copper alloy and process for obtaining same,
5916385,Aluminum-cooper alloy,
5916382,High corrosion resistant high strength superalloy and gas turbine utilizing the alloy,
5916380,Fe-Ni alloy for parts of electron-gun and blanked parts for electron-gun,
5916377,Packed bed carburization of tantalum and tantalum alloy,
5914088,Apparatus for continuously annealing amorphous alloy cores with closed magnetic path,
5913989,Process for producing aluminum alloy can body stock,
5912073,Bearing made of abrasion-resistant aluminum alloy,
5911949,Abrasion resistant copper alloy,
5911866,Acid tin-silver alloy electroplating bath and method for electroplating tin-silver alloy,
5911845,Extruded articles of age-hardening aluminum alloy and method for production thereof,
5911840,Process for manufacturing a magnetic component made of an iron-based soft magnetic alloy having a nanocrystalline structure,
5911809,Cobalt-tin alloy coating on aluminum by chemical conversion,
5911513,Sliding bearing of copper-based alloy,
5910379,Hydrogen absorbing alloy for a negative electrode of an alkaline storage battery,
5908518,AlMgMn alloy product for welded construction with improved corrosion resistance,
5908517,"Alloy, in particular for use in the manufacture of frames for glass, jewelry, and the like",
5908514,Magnetic alloy for improved corrosion resistance and magnetic performance,
5908513,Cast alloy used for production of rare earth magnet and method for producing cast alloy and magnet,
5908487,Shaped body of hydrogen absorbing alloy and container packed with hydrogen absorbing alloy,
5907790,Aluminum-palladium alloy for initiation of electroless plating,
5906945,Method for testing and determining the alloy class of an aluminum alloy,
5906896,Rotary seal member coated with a chromium carbide-age hardenable nickel base alloy,
5906725,Method for preparing nickel-zinc-copper or nickel-zinc alloy electroplating solutions from zinc-containing waste articles having a nickel/copper electroplating layer,
5906717,Sputtering target of single crystal aluminum alloy,
5906689,Corrosion resistant aluminum alloy,
5905424,Bonded magnet made from gas atomized powders of rare earth alloy,
5904754,Diffusion-bonded palladium-copper alloy framed membrane for pure hydrogen generators and the like and method of preparing the same,
5904549,Methods for growing semiconductors and devices thereof from the alloy semiconductor GaInNAs,
5903813,Method of forming thin dense metal sections from reactive alloy powders,
5902943,Aluminium alloy powder blends and sintered aluminium alloys,
5902700,Hydrogen storage alloy electrode and manufacturing method of the same,
5902546,Aluminum alloy impeller and manufacturing method of the same,
5902472,"Aqueous solution for forming metal complexes, tin-silver alloy plating bath, and process for producing plated object using the plating bath",
5902424,Method of making an article of manufacture made of a magnesium alloy,
5901728,Aluminum alloy valve spring retainer and method of making same,
5901071,"Method of evaluating corrosion resistance of metal material, method of designing alloy of high corrosion resistance, method of diagnosing corroded state of metal material, and method of operating plant",
5900558,Container packed with powder of hydrogen absorbing alloy,
5900334,Hydrogen occluding alloy,
5900210,High-strength and high-ductility aluminum-base alloy,
5900080,Thixotropic forming process for wheels fashioned in rheocast metal alloy and fitted with pneumatic tires,
5900078,High-temperature sulfidation-corrosion resistant nickel-base alloy,
5897966,High temperature alloy article with a discrete protective coating and method for making,
5897720,Aluminum-copper-magnesium-manganese alloy useful for aircraft applications,
5897718,Nickel alloy for turbine engine components,
5896784,Die for superplastic forming of titanium-based alloy,
5896664,Process for producing aluminum alloy bearing,
5896078,Soft magnetic alloy thin film and plane-type magnetic device,
5895517,Sintered Fe alloy for valve seat,
5895516,Bearing alloy for high-temperature application,
5894879,Method of manufacturing aluminum alloy sheet,
5894085,Device for determining the purity of a metal alloy,
5894054,Aluminum components coated with zinc-antimony alloy for manufacturing assemblies by CAB brazing,
5894010,Optimized gray cast iron plate alloy for utility vehicle brake disks,
5893953,Copper alloy and process for obtaining same,
5892278,Aluminum and aluminum alloy radiator for semiconductor device and process for producing the same,
5891510,Method for manufacturing a hydrogen storage alloy electrode,
5891388,Fe-Mn vibration damping alloy steel having superior tensile strength and good corrosion resistance,
5891273,Cylinder liner of a hypereutectic aluminum/silicon alloy for casting into a crankcase of a reciprocating piston engine and process for producing such a cylinder liner,
5891270,Heat-treatment of glassy metal alloy for article surveillance system markers,
5891191,Cobalt-chromium-molybdenum alloy stent and stent-graft,
5891112,High performance superelastic alloy braid reinforced catheter,
5888450,Fine grained ductile plastic injection molds forging tools and machine components and alloy steel therefor having a titanium nitride pinned austenitic grain structure,
5888373,Method for repairing nickel-zinc-copper or nickel-zinc alloy electroplating solutions from acidic waste solutions containing nickel and zinc ions and electroplating thereof,
5888320,Aluminum alloy having improved damage tolerant characteristics,
5888317,Hydrogen-storage material employing ti-mn alloy system,
5888201,Titanium alloy self-expanding stent,
5887952,Light alloy wheel assembly for an automobile,
5887045,"Zirconium alloy tube for a nuclear reactor fuel assembly, and method for making same",
5886518,Nickel alloy magnetostrictive wire and displacement detection device using same,
5885476,Composition for microetching copper or copper alloy,
5885381,"Ni-Ti-Pd superelastic alloy material, its manufacturing method, and orthodontic archwire made of this alloy material",
5885378,Hydrogen occluding alloy and electrode made of the alloy,
5885376,Corrosion-resistant high-strength copper based alloy having excellent blankability,
5885375,"High strength titanium alloy, product made of the titanium alloy and method for producing the product",
5882587,Lead alloy used for sliding bearing,
5882586,Heat-resistant nickel-based alloy excellent in weldability,
5882443,Strontium-aluminum intermetallic alloy granules,
5882441,Silver colored alloy with low percentage copper,
5882440,Heat-resistant alloy steel for hearth metal members of steel material heating furnaces,
5882439,Chromized heat-resistant alloy members and a process for the production thereof,
5881356,Method for the case-hardening of higher-molybdenum-alloy sintered steels,
5879970,Process of growing polycrystalline silicon-germanium alloy having large silicon content,
5879818,Nickel-based alloy excellent in corrosion resistance and workability,
5879478,Process for semi-solid forming of thixotropic aluminum-silicon-copper alloy,
5879476,"Copper alloy having improved corrosion resistance, commutator and motor using the same",
5879475,"Vanadium-free, lithium-free aluminum alloy suitable for forged aerospace products",
5879429,Method for producing hydrogen storage alloy electrode,
5879216,Method of fixing mercury containing alloy within fluorescent tubes,
5876869,Hydrogen absorbing alloy electrodes,
5876867,"Platinum skeleton alloy-supported electrocatalyst, electrode using the electrocatalyst, and process for producing the electrocatalyst",
5876524,Method for the manufacture of tubes of a zirconium based alloy for nuclear reactors and their usage,
5876519,Fe-based amorphous alloy,
5876517,Chromate-plating bath and process for finishing zinc zinc alloy or cadmium surfaces,
5876481,Low alloy steel powders for sinterhardening,
5876434,Implantable medical devices of shape memory alloy,
5876017,Plumbing fixture carrying drinking water comprised of a copper alloy,
5874168,Fluorocarbon compound-hydrogen storage alloy composite and method of manufacturing the same,
5874043,"Lead-free, high tin ternary solder alloy of tin, silver, and indium",
5873954,Amorphous alloy with increased operating induction,
5873950,Strengthenable ethylene pyrolysis alloy,
5872888,Electric radiator with a heating body embedded in a light alloy unit,
5872501,Rare earth bonded magnet and rare earth-iron-boron type magnet alloy,
5871262,"Precision super high strength wheel, roller and track tread consisting of isoplast or victrex peek with pure carbon fiber content, and with commercial carbon fibers forming an alloy on an improved tread locking insert wheel hub",
5870989,Abrasion resistant valve seat made of sintered alloy for internal combustion engines,
5869811,"Method and equipment for bringing metal alloy ingots, billets and the like to the semisolid or semiliquid state in readiness for thixotropic forming",
5868879,"Composite article, alloy and method",
