patent_no,title,
7628903,Silver and silver alloy plating bath,
7628873,Beryllium copper alloy and method of manufacturing beryllium copper alloy,
7627075,Zirconium-based alloy and method for making a component for nuclear fuel assembly with same,
7625523,Ga-base alloy and organic function element using the same,
7625454,Al-Si-Mg-Zn-Cu alloy for aerospace and automotive castings,
7624906,Ultrasonic brazing of aluminum alloy and aluminum matrix composite,
7624905,Apparatus for manufacturing sealed flux laminated alloy filler metal,
7623612,Bi-alloy spacer grid and associated methods,
7622011,"Spherical particles of Fe base metallic glass alloy, Fe base sintered alloy soft magnetic material in bulk form produced by sintering the same, and method for their production",
7622010,Method and apparatus for producing granulated powder of rare earth alloy and method for producing rare earth alloy sintered compact,
7621244,"Titanium alloy tappet, manufacturing method thereof, and jig used in manufacturing tappet",
7618505,Target of high-purity nickel or nickel alloy and its producing method,
7618504,"TiA1 based alloy, production process therefor, and rotor blade using same",
7618502,"Wear resistant aluminum alloy elongate body, manufacturing method thereof and piston for car air conditioner",
7616410,Magnetic detecting element having free layer formed of NiFe alloy and method of manufacturing the same,
7615125,Aluminum alloy products with high toughness and production process thereof,
7614658,Light alloy extruded frame,
7611984,Manufacture method for semiconductor device having improved copper diffusion preventive function of plugs and wirings made of copper or copper alloy,
7611778,Simultaneous multi-alloy casting,
7611590,Wear resistant alloy for valve seat insert used in internal combustion engines,
7609489,Magnetic sensor using NiFe alloy for pinned layer,
7608345,Method of producing an aluminium alloy brazing sheet and light brazed heat exchanger assemblies,
7608157,Heat resistance copper alloy materials,
7605481,Nickel alloy sputtering target and nickel alloy thin film,
7604704,Balanced Al-Cu-Mg-Si alloy product,
7604680,"Producing nickel-base, cobalt-base, iron-base, iron-nickel-base, or iron-nickel-cobalt-base alloy articles by reduction of nonmetallic precursor compounds and melting",
7603890,Method of inspecting a metal alloy part for incipient melting,
7601232,.alpha.-.beta. titanium alloy tubes and methods of flowforming the same,
7601196,"Alloy powder for forming hard phase and ferriferous mixed powder using the same, and manufacturing method for wear resistant sintered alloy and wear resistant sintered alloy",
7600499,Titanium alloy valve lifter,
7598513,"Si.sub.xSn.sub.yGe.sub.1-x-y and related alloy heterostructures based on Si, Ge and Sn",
7598095,Ferroelectric memory and ferroelectric capacitor with Ir-alloy electrode or Ru-alloy electrode and method of manufacturing same,
7597842,Hydrogen permeable alloy,
7597770,Aluminum-based alloy and method of fabrication of semiproducts thereof,
7595269,Semiconductor device comprising a copper alloy as a barrier layer in a copper metallization layer,
7594972,"Alloy lump for R-T-B type sintered magnet, producing method thereof, and magnet",
7591916,Method for producing composite materials comprising Cu-based amorphous alloy and high fusion point element and composite materials produced by the method,
7591911,"Plated film of gold-cobalt amorphous alloy, electroplating bath, and method for electroplating",
7591910,Bulk amorphous refractory glasses based on the Ni(-Cu-)-Ti(-Zr)-Al alloy system,
7591716,Producing notch feature in small diameter steel alloy needle wire,
7591410,Methods for extending the life of alloy steel welded joints by elimination and reduction of the HAZ,
7589937,Thin film magnetic head with high Fe alloy plating film and manufacturing method thereof,
7588621,"Ti(C,N)-(Ti,Nb,W)(C,N)-co alloy for milling cutting tool applications",
7588073,Aluminum alloy-based extruded multi-path flat tubes for the heat exchanger and method of manufacture thereof,
7587899,Shape memory alloy actuated adaptive exhaust nozzle for jet engine,
7585378,"Methods for producing raw material alloy for rare earth magnet, powder and sintered magnet",
7584778,Method of producing a castable high temperature aluminum alloy by controlled solidification,
7582381,Alkaline storage cell and hydrogen storage alloy for negative electrode of alkaline storage cell,
7582171,"High-strength, soft-magnetic iron-cobalt-vanadium alloy",
7581706,Shape memory alloy (SMA) system,
7580231,Magneto-resistive element having a free layer provided with a ternary alloy layer,
7578893,Electrical contact material comprising a cobalt-nickel-iron alloy,
7578892,Magnetic alloy material and method of making the magnetic alloy material,
7578866,Iron-based sintered alloy having excellent machinability,
7575826,Fuel cell with metal alloy contacts that form passivating conductive oxide surfaces,
7575811,Aluminum alloy sheet for superplastic forming,
7575714,Silver alloy excellent in reflectance maintenance property and method for producing an optical recording medium,
7575712,Ferromagnetic alloy for induction cooking,
7575041,Horizontally continuously cast rod of aluminum alloy and method and equipment for producing the rod,
7572521,Aluminum alloy for surfaces which are subjected to extreme stresses due to friction,
7572517,Reflective or semi-reflective metal alloy coatings,
7571757,"Alloy flake for rare earth magnet, production method thereof, alloy powder for rare earth sintered magnet, rare earth sintered magnet, alloy powder for bonded magnet and bonded magnet",
7570145,Soft magnetism thin film inductor and magnetic multi-element alloy film,
7569926,Wafer level hermetic bond using metal alloy with raised feature,
7569286,"Hardfacing alloy, methods and products",
7569251,Method of forming a thermal protective coating on a super alloy metal substrate,
7569116,Co-Cr-Mo-based alloy and production method therefor,
7569115,Assemblages of magnetic alloy nanoparticles,
7566508,Perpendicular media with Cr-doped Fe-alloy-containing soft underlayer (SUL) for improved corrosion performance,
7566417,Ag base alloy thin film and sputtering target for forming Ag base alloy thin film,
7566415,Method for manufacturing fully dense metal sheets and layered composites from reactive alloy powders,
7565739,Method of making zinc-aluminum alloy connection,
7563408,Copper alloy and method of manufacturing the same,
7563353,Method of forming Sn-Ag-Cu ternary alloy thin-film on base material,
7562807,Weld filler for welding dissimilar alloy steels and method of using same,
7562692,Aluminum alloy-boron carbide composite material,
7560515,PVC alloy for use in air bag doors,
7560000,Titanium alloy part and method for producing the same,
7556669,Au-sn alloy powder for solder paste,
7554201,Tin-bismuth (Sn-Bi) family alloy solder and semiconductor device using the same,
7553913,Random and non-random alkylene oxide polymer alloy compositions,
7553517,Method of applying a cerium diffusion coating to a metallic alloy,
7553445,Manufacturing processes of sintered alloy and oil-impregnated sintered bearing,
7550047,Rare earth element-iron-boron alloy and magnetically anisotropic permanent magnet powder and method for production thereof,
7550028,Method for recycling aluminum-lithium-type alloy scrap,
7547913,Phase-change memory device using Sb-Se metal alloy and method of fabricating the same,
7547671,"Discoloration removal cleaning agent for titanium and titanium alloy building materials, and discoloration removal cleaning method",
7547432,Process for the storage of hydrogen using a system that strikes a balance between an alloy of magnesium and palladium and the corresponding hydride,
7547411,Creep-resistant magnesium alloy for casting,
7547367,Method for producing magnetically active shape memory metal alloy,
7547365,"Process for producing, through strip casting, raw alloy for nanocomposite type permanent magnet",
7547188,"Ni-based alloy member, method of producing the alloy member, turbine engine part, welding material, and method of producing the welding material",
7545604,Magnetic recording medium having a cobalt-based alloy film for high density recording and magnetic storage device using same,
7545560,AlAs/GaAs alloy to enhance n-type doping in AlGaAs distributed bragg reflector,
7545040,"Copper alloy for wiring, semiconductor device, method for forming wiring and method for manufacturing semiconductor device",
7544886,"Extra-fine copper alloy wire, extra-fine copper alloy twisted wire, extra-fine insulated wire, coaxial cable, multicore cable and manufacturing method thereof",
7544442,Hydrogen-absorbing alloy electrode and alkaline storage battery,
7544259,"Copper alloy, copper alloy producing method, copper complex material, and copper complex material producing method",
7544257,Single crystal shape memory alloy devices and methods,
7542237,Apparatus and method for slider including shape memory alloy pads in a hard disk drive,
7540997,Medical devices having alloy compositions,
7540996,Laser sintered titanium alloy and direct metal fabrication method of making the same,
7540995,Process for forming an improved metal alloy stent,
7540994,Process for forming an improved metal alloy stent,
7540899,"Shape memory alloy thin film, method of fabrication, and articles of manufacture",
7540439,Reactive milling process for the manufacture of a hydrogen storage alloy,
7539016,Electromagnetically-actuated micropump for liquid metal alloy enclosed in cavity with flexible sidewalls,
7537814,Alloy blends of polyurethane and latex rubber,
7537727,Eglin steel--a low alloy high strength composition,
7534311,R-t-b sintered magnet and rare earth alloy,
7531904,Al-Ni-B alloy wiring material and element structure using the same,
7531217,Methods for making high-temperature coatings having Pt metal modified .gamma.-Ni +.gamma.'-Ni.sub.3Al alloy compositions and a reactive element,
7531130,Anti-galling alloy with finely dispersed precipitates,
7531054,Nickel alloy and method including direct aging,
7524582,Zinc powder or zinc alloy powder for alkaline batteries,
7524027,Printhead assembly with a series of printhead modules mounted in a carrier of a metal alloy,
7521252,Methods for forming palladium alloy thin films and optical hydrogen sensors employing palladium alloy thin films,
7517575,Optical information recording media and silver alloy reflective films for the same,
7517492,Processes for sintering aluminum and aluminum alloy components,
7516526,Spun metal form used to manufacture dual alloy turbine wheel,
7514726,Graded index silicon geranium on lattice matched silicon geranium semiconductor alloy,
7514178,"Hydrogen-absorbing alloy for alkaline storage battery, method of manufacturing the same, and alkaline storage battery",
7514155,High strength aluminium alloy brazing sheet,
7514037,AG base alloy thin film and sputtering target for forming AG base alloy thin film,
7514036,Hydrogen permeable alloy and method for producing the same,
7513962,Alloy substantially free of dendrites and method of forming the same,
7513574,"Light alloy seat back frame for vehicle seat, and reclining vehicle-seat with the seat back frame",
7513296,Clustered investment-casting shells for casting thin-walled golf club-heads of titanium alloy,
7511350,Nickel alloy silicide including indium and a method of manufacture therefor,
7510680,"Method for producing a metallic alloy by dissolution, oxidation and chemical reduction",
7510615,Age-hardening copper alloy as material for producing casting molds,
7507495,Hydrogen absorption induced metal deposition on palladium and palladium-alloy particles,
7507306,Precipitation-strengthened nickel-iron-chromium alloy and process therefor,
7507305,Wear-resistant copper-based alloy,
7507304,Copper alloy sputtering target and semiconductor element wiring,
7507303,Carbonitrided low manganese carbon steel alloy driveline component,
7506794,High-temperature alloy standoffs for injection molding of solder,
7504166,Magnetic recording media having five element alloy deposited using pulsed direct current sputtering,
7504017,Method for electrowinning of titanium metal or alloy from titanium oxide containing compound in the liquid state,
7503959,"Method for manufacturing rhenium-containing alloy powder, rhenium-containing alloy powder, and conductor paste",
7503444,Shape memory alloy rotary actuator with capacitive position feedback,
7502210,CPP magnetic detecting device containing NiFe alloy on free layer thereof,
7501925,Magnetic core using amorphous soft magnetic alloy,
7501207,Hydrogen absorbing alloy and secondary battery,
7500987,Amorphous alloy stents,
7495333,Seal cover structure comprising a nickel-tin (Ni--Sn) alloy barrier layer formed between a nickel (Ni) plating layer and a gold-tin (Au--Sn) brazing layer having Sn content of 20.65 to 25 WT % formed on the seal cover main body,
7495215,"Probe for a scanning magnetic force microscope, method for producing the same, and method for forming ferromagnetic alloy film on carbon nanotubes",
7494618,Alloy tool steel,
7494617,Enhanced formulation of cobalt alloy matrix compositions,
7494552,Al-Cu alloy with high toughness,
7494043,Method for constructing a welded construction utilizing an Al-Mg-Mn weld filler alloy,
7491890,Electric wire having a core of aluminum or aluminum alloy,
7491449,Copper-silver alloy wire and method for manufacturing the same,
7491361,Burning-on alloy for the production of ceramically veneered dental restorations,
7491278,Method of heat treating an aluminium alloy member and apparatus therefor,
7491269,Method for catalytic growth of nanotubes or nanofibers comprising a NiSi alloy diffusion barrier,
7491136,Low-density FeAlMn alloy golf-club heads and golf clubs comprising same,
7490992,Integral bearing unit made from a slippery/polymer alloy,
7490752,Manufacturing method for friction welded aluminum alloy parts,
7486498,Strong substrate alloy and compressively stressed dielectric film for capacitor with high energy density,
7485200,Copper alloy and method of manufacturing the same,
7485199,Ni based alloy with excellent corrosion resistance to supercritical water environments containing inorganic acids,
7481971,Iridium alloy,
7481970,Heat resistant alloy for use as material of engine valve,
7481898,Method for fabricating a thick Ti64 alloy article to have a higher surface yield and tensile strengths and a lower centerline yield and tensile strengths,
7481698,Sintered rare earth magnetic alloy wafer surface grinding machine,
7481054,Shape memory alloy actuator,
7480122,Magnetic detecting device having free layer or pinned layer formed by lamination of magnetic alloy and Cu layer and method of manufacturing magnetic detecting device,
7478665,Method of manufacturing magnesium alloy material,
7476431,"Silver alloy reflective films for optical information recording media, silver alloy sputtering targets therefor, and optical information recording media",
7473587,High-quality SGOI by oxidation near the alloy melting temperature,
7473328,Composite alloy having a three-dimensional periodic hierarchical structure and method of producing the same,
7473327,Wear-resistant aluminum alloy excellent in caulking property and extruded product made thereof,
7472650,Nickel alloy plated structure,
7470804,Magnesium alloy-bonding organopolysiloxane composition and composite article,
7469538,Self assembling/quick assembly structure using shape memory alloy materials,
7468493,Method of connecting aluminum alloy die cast member,
7468045,Titanium molybdenum alloy guidewire,
7466525,Magnetic sensing element including laminated film composed of half-metal and NiFe alloy as free layer,
7465649,Method of forming a split poly-SiGe/poly-Si alloy gate stack,
7465385,Gold alloy electrolytes,
7464634,Cold launch system comprising shape-memory alloy actuator,
7464548,Shape memory alloy linear actuator,
7462672,Polymer alloy,
7461770,Copper-based brazing alloy and brazing process,
"H2,227",High speed titanium alloy microstructural conversion method,
7459736,Ferroelectric capacitor and ferroelectric memory with Ir-Ru alloy electrode and method of manufacturing the same,
7459321,Method of storing a data bit in a fast-write alloy,
7459221,Magnetic film composed of a first alloy film including iron and platinum or iron and palladium,
7459036,Hafnium alloy target and process for producing the same,
7455714,Powder of fine alloy particles having an uneven surface and method of manufacturing the powder,
7455712,Face-centered cubic structure alloy particles and method of manufacturing same,
7453212,Ceramic discharge vessel having tungsten alloy feedthrough,
7452604,Reflective Ag alloy film for reflectors and reflector provided with the same,
7452502,Metal alloy for a stent,
7452501,Metal alloy for a stent,
7452454,Anodized coating over aluminum and aluminum alloy coated substrates,
7452430,Method for reforming A1 alloy castings,
7452037,Alloy wheel with mating wheel cover,
7449664,Oil and gas well alloy squeezing method and apparatus,
7449075,Method for producing a beta-processed alpha-beta titanium-alloy article,
7446037,Cladded silver and silver alloy metallization for improved adhesion and electromigration resistance,
7445751,Creep resistant magnesium alloy,
7445749,Stainless steel alloy having lowered nickel chromium toxicity and improved biocompatibility,
7445681,Intermetallic compound superconducting material comprising magnesium and beryllium and alloy superconducting material containing the intermetallic compound,
7444812,Shape memory alloy MEMS heat engine,
7443029,Adhesion of copper and etch stop layer for copper alloy,
7443003,Shape memory alloy information storage device,
7442491,Aluminum alloy blank for lithographic printing plate and support for lithographic printing plate,
7442443,Chromium-nickel stainless steel alloy article having oxide coating formed from the base metal suitable for brake apparatus,
7442266,High-strength titanium alloy and method for production thereof,
7442264,Method of using low alloy anticoking steels with an increased silicon and manganese content in refining and petrochemicals applications,
7442262,"Alloy flake for rare earth magnet, production method thereof, alloy powder for rare earth sintered magnet, rare earth sintered magnet, alloy powder for bonded magnet and bonded magnet",
7442261,Iron-base alloy containing chromium-tungsten carbide and a method of producing it,
7442225,High strength high toughness Mo alloy worked material and method for production thereof,
7441335,Methods of electromagnetic forming aluminum alloy wheel for automotive use,
7438849,Titanium alloy and process for producing the same,
7437939,Pressure and mechanical sensors using titanium-based superelastic alloy,
"D578,538",Alloy rack door,
7435690,"Method of preparing a silicon dioxide layer by high temperature oxidation on a substrate having, at least on the surface, germanium or a silicon-germanium alloy",
7435305,Cast aluminum alloy compressor wheel for a turbocharger,
7435282,Elemental material and alloy,
7431981,Polymer composite structure reinforced with shape memory alloy and method of manufacturing same,
7431817,Electroplating solution for gold-tin eutectic alloy,
7431070,"Rare earth magnet alloy ingot, manufacturing method for the same, R-T-B type magnet alloy ingot, R-T-B type magnet, R-T-B type bonded magnet, R-T-B type exchange spring magnet alloy ingot, R-T-B type exchange spring magnet, and R-T-B type exchange spring bonded magnet",
7425765,Zinc-aluminum solder alloy,
7425255,Method for producing alloy deposits and controlling the nanostructure thereof using negative current pulsing electro-deposition,
7425239,Fe-based amorphous alloy ribbon,
7422804,Metal dusting resistant stable-carbide forming alloy surfaces,
7422645,Method of press quenching aluminum alloy 6020,
7419907,Eliminating metal-rich silicides using an amorphous Ni alloy silicide structure,
7419729,Multilayered ferromagnetic laminate having alternating cobalt alloy and iron-nitrogen alloy films for use with magnetic heads,
7419711,Ag base alloy thin film and sputtering target for forming Ag base alloy thin film,
7419679,Medical implant having a layer of titanium or titanium alloy fibers,
7419554,Engine cylinder block and cylinder head fabricated from a grey cast iron alloy,
7417249,Semiconductor device having a wiring including an aluminum carbon alloy and titanium or molybdenum,
7416620,Copper alloy and method for its manufacture,
7416619,Application of an alloy in kitchen utensil products,
7416618,High strength corrosion resistant alloy for oil patch applications,
7413725,Copper and/or zinc alloy nanopowders made by laser vaporization and condensation,
7413705,Rose-colored gold alloy compositions with reversible hardness characteristics,
7413619,Copper alloy,
7413618,Silver alloy for reflective film,
7413589,Method of producing hydrogen storage alloy,
7410705,Rare earth-transition metal alloy articles,
7410546,Platinum alloy and method of production thereof,
7407714,"Process by producing an aluminium alloy brazing sheet, aluminium alloy brazing sheet",
7407713,Simultaneous multi-alloy casting,
7405422,Epitaxial and polycrystalline growth of Si.sub.1-x-yGe.sub.xC.sub.y and Si.sub.1-yC.sub.y alloy layers on Si by UHV-CVD,
7399370,Cu-base amorphous alloy,
7396867,Organopolysiloxane composition for bonding to magnesium alloy,
7396597,Ni-Cr-Fe alloy and Ni-Cr-Fe alloy pipe having resistance to carburization and coking,
7396424,Method of manufacturing a hard precious metal alloy member,
7395884,High-strength/high toughness alloy steel drill bit blank,
7395825,Method and device for activating an element made of a shape memory alloy,
7393601,Weak antiferromagnetically coupled media with a five element magnetic alloy and a low moment stabilizing layer,
7393595,Composite comprising a metal or alloy and a shape memory alloy,
7393499,Ni alloy anode material for Ni electroplating,
7393084,"Substrate for ink jet head with TaCr alloy protective layer, ink jet head utilizing the same and producing method therefor",
7390369,Method for producing rare earth based alloy powder and method for producing rare earth based sintered magnet,
7390348,Hydrogen permeation alloy and a method of manufacturing the same,
7389675,Miniaturized metal (metal alloy)/ PdO.sub.x/SiC hydrogen and hydrocarbon gas sensors,
7388369,Method and apparatus for measuring hydrogen concentration in zirconium alloy components in the fuel pool of a nuclear power plant,
7387844,Aluminum alloy composite for brazing and heat exchanger including the same,
7385293,"Copper alloy, fabrication method thereof, and sputtering target",
7385013,"Polymer alloy, thermoplastic resin composition, and molded article",
7384901,Process for cleaning aluminum and aluminum alloy surfaces with nitric acid and chromic acid-free compositions,
7384488,Method for producing gears and/or shaft components with superior bending fatigue strength and pitting fatigue life from conventional alloy steels,
7381477,Rare earth-transition metal alloy articles,
7381369,Free cutting alloy,
7381282,"Co alloy target and its production method, soft magnetic film for perpendicular magnetic recording and perpendicular magnetic recording medium",
7381239,Alloy nano-particles,
7379279,Magnetoresistive film with pinning layer interposed between pinned layer and soft magnetic nickel iron alloy layer,
7378336,Split poly-SiGe/poly-Si alloy gate stack,
7377419,Brazing open cell reticulated copper foam to stainless steel tubing with vacuum furnace brazed gold/indium alloy plating,
7374840,Centrifugally atomized zinc alloy powder for alkaline batteries,
7374622,Bainitic steel alloy,
7371988,Methods for extending the life of alloy steel welded joints by elimination and reduction of the HAZ,
7371295,Shape memory alloy and method for producing same,
7371272,"Modifier for hydrophilicity, hydrophilic modification method and aluminum material or aluminum alloy material modified hydrophilic thereby",
7368048,Method for forming Re alloy coating film having high-Re-content through electroplating,
7368047,Method of preparing copper plating layer having high adhesion to magnesium alloy using electroplating,
7368022,Bulk amorphous refractory glasses based on the Ni-Nb-Sn ternary alloy system,
7368019,"Method for preventing elution of lead and/or nickel from copper alloy piping material such as valve or pipe joint and copper alloy piping material, and fluid for use in cleaning piping material",
7367776,Turbine engine stator including shape memory alloy and clearance control method,
7367096,"Equipment for mechanical machining, in particular for the turning and drilling of light alloy wheels",
7366644,Method of judging practical conditions for use of an ordered alloy under irradiation environments,
7364631,Zirconium-based alloy having a high resistance to corrosion and to hydriding by water and steam and process for the thermomechanical transformation of the alloy,
7364630,"Al-Mg-Si alloy sheet excellent in surface properties, manufacturing method thereof, and intermediate material in the manufacturing thereof",
7364211,Vehicle lock controlled by a shape memory alloy actuator,
7361707,Alloy blends of polyurethane and latex rubber,
7361411,"Hardfacing alloy, methods, and products",
7360676,Welded aluminum alloy structure,
7360488,Single phase tungsten alloy,
7359415,Cr.sup.4+-doped mixed alloy laser materials and lasers and methods using the materials,
7359148,Thin film magnetic head including NiPRe alloy gap layer,
