patent_no,title,
5047091,"Nickel based monocrystalline superalloy, method of heat treating said alloy, and parts made therefrom",
5046247,Method for manufacturing heat transfer module with hydrogen adsorption alloy,
5045411,Alloy compositions,
5045110,Aluminium-strontium master alloy,
5043773,"Wafer base for silicon carbide semiconductor devices, incorporating alloy substrates",
5043369,Glass/glass-ceramic-plastic alloy articles,
5043233,Hydrogen-absorbing alloy electrode for use in an alkaline storage cell and its manufacturing method,
5043230,Zinc-maganese alloy coated steel sheet,
5041340,Fiber-reinforced light alloy member excellent in heat conductivity and sliding properties,
5041262,Method of modifying multicomponent titanium alloys and alloy produced,
5041176,Particle dispersion-strengthened copper alloy,
5039576,Electrodeposited eutectic tin-bismuth alloy on a conductive substrate,
5039574,Dental prosthesis with cobalt alloy frame,
5039479,"Silver alloy compositions, and master alloy compositions therefor",
5039476,Method for production of powder metallurgy alloy,
5039356,Method to produce fatigue resistant axisymmetric titanium alloy components,
5037778,Die attach using gold ribbon with gold/silicon eutectic alloy cladding,
5037708,Silver palladium alloy,
5037608,Method for making a light metal-rare earth metal alloy,
5037494,Amorphous alloy for strip-shaped sensor elements,
5035754,Heat treating method for high strength aluminum alloy,
5035749,Process for removing tin and tin-lead alloy from copper substrates,
5035530,Actuator utilizing shape memory alloy and articulated arm comprising this actuator,
5034273,Nitrogen-containing magnetic alloy film,
5034262,Paint film structure formed on aluminum member or aluminum alloy member,
5032644,Styrenic polyamide alloy,
5032470,Optical recording medium with an aluminum alloy metallic layer containing at least hafnium,
5032469,Metal alloy coatings and methods for applying,
5032358,Resistance welding electrode of chalcogene bearing copper alloy,
5032355,Method of manufacturing sintering product of Fe-Co alloy soft magnetic material,
5032244,Anodic treatment apparatus for aluminium alloy pistons,
5032195,FE-base shape memory alloy,
5032189,Method for refining the microstructure of beta processed ingot metallurgy titanium alloy articles,
5031878,Valve seat made of sintered iron base alloy having high wear resistance,
5031063,Magnetic head for use in a magnetic recording apparatus using a soft magnetic alloy film consisting primarily of cobalt,
5030519,Tungsten carbide-containing hard alloy that may be processed by melting,
5030373,Surface-treating agents for copper and copper alloy,
5030048,Expandable tool holding device using a fusible alloy,
5028493,Aluminum alloy locally having a composite portion,
5028393,"Al-based alloy for use as sliding material, superior in fatigue resistance and anti-seizure property",
5028391,Copper-nickel-silicon-chromium alloy,
5028282,Cu-Ni-Sn alloy with excellent fatigue properties,
5028280,Soft magnetic alloy films having a modulated nitrogen content,
5026521,Zirconium-titanium and/or tantalum oxygen alloy,
5026441,High strengths copper base shape memory alloy and its manufacturing process,
5026434,Copper-iron-cobalt-titanium alloy with high mechanical and electrical characteristics and its production process,
5026433,Grain refinement of a copper base alloy,
5025799,Steerable memory alloy guide wires,
5024980,Ceramic dielectric alloy,
5024905,Platinum alloy electrocatalyst,
5024903,Magnetic recording medium having a magnetic layer of a quaternary alloy,
5024900,Composite nickel-phosphorus alloy plated metal sheet excellent in strippability and having high hardness and method for manufacturing same,
5024815,Copper alloy with phosphorus and iron,
5024814,Copper alloy having excellent hot rollability and excellent adhesion strength of plated surface thereof when heated,
5024813,Magnesium-titanium type alloy and method for producing the same,
5024737,Process for producing a reactive metal-magnesium alloy,
5024733,Palladium alloy electroplating process,
5024497,Shape memory alloy optical fiber switch,
5024369,Method to produce superplastically formed titanium alloy components,
5023398,Aluminum alloy semiconductor packages,
5023145,Multi carbide alloy for bimetallic cylinders,
5023144,Silver alloy foil for interconnector for solar cell,
5023113,Hot dip aluminum coated chromium alloy steel,
5023051,Hypoeutectic aluminum silicon magnesium nickel and phosphorus alloy,
5022918,Heat-resistant aluminum alloy sinter and process for production of the same,
5022455,Method of producing aluminum base alloy containing silicon,
5021523,Polymer alloy of polyarylene thioether and a process for producing the same,
5021301,"Method of producing a steel sheet plated with Zn-Mg alloy superior both in plating adhesion and corrosion resistance, and steel sheet plated with the same",
5021214,Ag alloy of high discoloration resistance,
5021106,Brazeable aluminum alloy sheet and process of making same,
5021105,Copper alloy for electronic instruments,
5020770,Combination of mold and alloy core pin,
5019358,Reactor with hydrogen adsorption alloy,
5019338,Alloy for building JP valve,
5019335,Gold colored metal alloy,
5019333,Zirconium alloy for use in spacer grids for nuclear reactor fuel claddings,
5019332,"Heat, corrosion, and wear resistant steel alloy",
5019331,Heat-resistant alloy,
5019190,Fe-based soft magnetic alloy,
5019188,Process for forming an aluminum alloy thin sheet by hot and cold rolling,
5019185,Method for producing high strength Cu-Ni-Sn alloy containing manganese,
5019179,Method for plastic-working ingots of heat-resistant alloy containing boron,
5019178,Aluminum-silicon alloy article and method for its production,
5019163,Corrosion/wear-resistant metal alloy coating compositions,
5018874,Temperature monitoring device containing at least one element of an alloy which memorizes its shape,
5017337,Aluminum alloy for magnetic disc substrate execellent in platability,
5017336,Zironium alloy for use in pressurized nuclear reactor fuel components,
5017267,Composition and method for stripping tin or tin-lead alloy from copper surfaces,
5017249,Nickel-base alloy,
5017247,Rare earth magnet alloy,
5017244,Process for improving the electrical conductivity of a copper-nickel-iron alloy,
5015535,Article formed from a low carbon iron alloy having a corrosion resistant diffusion coating thereon,
5015308,Corrosion-resistant and heat-resistant amorphous aluminum-based alloy thin film and process for producing the same,
5015294,"Composition suitable for injection molding of metal alloy, or metal carbide powders",
5013618,Ternary alloy fuel cell catalysts and phosphoric acid fuel cell containing the catalysts,
5013357,Direct production of niobium titanium alloy during niobium reduction,
5012044,Assembly including a light alloy profiled member having one or more insulated electrical conductors and process for formation thereof,
5011798,Chromium additive and method for producing chromium alloy using the same,
5011659,Castable corrosion resistant alloy,
5011581,Process for producing a thin alloy film having high saturation magnetic flux density,
5011552,Method for producing a rare earth metal-iron-boron permanent magnet by use of a rapidly-quenched alloy powder,
5011547,Aluminum alloy composite material for brazing,
5011545,Method of manufacturing hard-to-work alloy articles such as of intermetallics and superconducting compounds,
5011311,Dental alloy,
5009844,Process for manufacturing spheroidal hypoeutectic aluminum alloy,
5008164,Hydrogen-absorbing alloy electrode,
5008073,Mn-B steel alloy composition,
5008011,Shower dechlorinator using granulated copper alloy filter material,
5006419,Structural component made of a titanium alloy and covered by a protective coating and method for producing the coating,
5006414,Process for modifying the surface of metal or metal alloy substrates and surface modified products produced thereby,
5006308,Nickel aluminide alloy for high temperature structural use,
5006307,"Hafnium containing niobium, titanium, aluminum high temperature alloy",
5005456,Hot shear cutting of amorphous alloy ribbon,
5004710,Method for the chemical preparation of zirconia alloy powders and article,
5004581,Dispersion strengthened copper-base alloy for overlay,
5004498,Dispersion strengthened copper alloy and a method of manufacturing the same,
5004036,Method for making metal matrix composites by the use of a negative alloy mold and products produced thereby,
5002837,"Zn-Mg alloy vapor deposition plated metals of high corrosion resistance, as well as method of producing them",
5002834,Oxidation resistant alloy,
5002732,Copper alloy having satisfactory pressability and method of manufacturing the same,
5002731,Corrosion-and-wear-resistant cobalt-base alloy,
5002730,Preparation of vanadium rich hydrogen storage alloy materials,
5002729,Case hardenable corrosion resistant steel alloy and article made therefrom,
5002728,Method of manufacturing soft magnetic Fe-Si alloy sintered product,
5001446,Shape memory alloy and electric path protective device utilizing the alloy,
5000915,Wear-resistant copper alloy,
5000914,Precipitation-hardening-type Ni-base alloy exhibiting improved corrosion resistance,
5000913,Hafnium containing high temperature Nb-Al alloy,
5000829,Process for preparing praseodymium metal or praseodymium-containing alloy,
5000273,Low melting point copper-manganese-zinc alloy for infiltration binder in matrix body rock drill bits,
5000244,Lost foam casting of dual alloy engine block,
4999160,"Aluminum alloy containing copper, silicon and titanium for VLSI devices",
4999158,Oxidation resistant iron base alloy compositions,
4999053,"Method of producing an iron-, cobalt- and nickel-base alloy having low contents of sulphur, oxygen and nitrogen",
4998239,Optical information recording medium containing a metal alloy as a reflective material,
4997623,"Heat-deformable, austenitic nickel-chromium-iron alloy with high oxidation resistance and thermal strength",
4996586,Crimp-type semiconductor device having non-alloy structure,
4996025,Engine bearing alloy composition and method of making same,
4995924,Synchronizer ring in speed variator made of copper-base alloy,
4995923,Thin film of amorphous alloy,
4995919,Method and apparatus for parting a deck of amorphous alloy ribbons,
4995733,Measurement sensor for the detection of temperatures in metal or alloy melts,
4995444,Method for producing metal or alloy casting composites reinforced with fibrous or particulate materials,
4994647,Covered electrode for use in arc welding of Cr-Mo type low alloy steels,
4994235,Wear-resistance aluminum bronze alloy,
4994155,"High speed tin, lead or tin/lead alloy electroplating",
4994122,"Corrosion resistant, magnetic alloy article",
4994109,Method for producing permanent magnet alloy particles for use in producing bonded permanent magnets,
4992242,Aluminum alloy with good fatigue strength,
4992238,Process for shaping and improving the mechanical properties of blanks produced by powder metallurgy from an alloy with increased high-temperature strength by extrusion,
4992117,"Heat resistant aluminum alloy excellent in tensile strength, ductility and fatigue strength",
4992115,Surface treatment chemical and bath for aluminum and its alloy,
4992095,Alloy target used for manufacturing magneto-optical recording medium,
H887,Dispersion strengthened tri-titanium aluminum alloy,
4990420,Electrophotographic photoreceptor with doped Se or Se alloy interlayer,
4990410,Coated surface refined sintered alloy,
4990309,High strength copper-nickel-tin-zinc-aluminum alloy of excellent bending processability,
4990308,Chromium containing high temperature Nb--Ti--Al alloy,
4990225,Method of manufacturing high magnetic flux density electrodeposited quaternary alloy thin film,
4990199,Oxidation-resistant and corrosion-resistant high-temperature alloy for directional solidification on the basis of an intermetallic compound of the nickel aluminide type,
4990198,High strength magnesium-based amorphous alloy,
4989064,Aluminum alloy line resistive to stress migration formed in semiconductor integrated circuit,
4988415,Method of producing an anti-wear coating including a chromium layer on a surface of a structural part of titanium or titanium-based alloy,
4987866,Light alloy piston for internal combustion engines,
4987562,Semiconductor layer structure having an aluminum-silicon alloy layer,
4987314,Actuator apparatus utilizing a shape-memory alloy,
4985401,Method for producing a superconductor of an immiscible alloy and its oxide,
4985400,Process for producing superconductive ceramics by atomization of alloy precurser under reactive atmospheres or post annealing under oxygen,
4985090,Non-ageing low-alloy hot-rolled strip-form formable steel,
4985089,Fe-base soft magnetic alloy powder and magnetic core thereof and method of producing same,
4985088,Fe-based soft magnetic alloy product,
4985073,Needle shaped alloy powders based on iron and their use,
4984581,Flexible guide having two-way shape memory alloy,
4983474,Hydroen absorbing Ni-based alloy and rechargeable alkaline battery,
4983357,"Heat-resistant TiAl alloy excellent in room-temperature fracture toughness, high-temperature oxidation resistance and high-temperature strength",
4983263,Zincate type zinc alloy electroplating bath,
4983230,Platinum-cobalt alloy permanent magnets of enhanced coercivity,
4983029,Eyeglass frame having Ti-Ni-V alloy element with improved wear comfortability,
4981741,Coating alloy,
4981647,Nitrogen strengthened FE-NI-CR alloy,
4981646,Corrosion resistant alloy,
4981527,"Tube, bar, sheet or strip made from zirconium alloy resistant both to uniform and nodular corrosion",
4981526,Composition for brazing aluminum or aluminum alloy and an aluminum or aluminum alloy product,
4981514,Method for manufacturing copper-base alloy,
4980244,"Protective alloy coatings comprising Cr-Al-Ru containing one or more of Y, Fe, Ni and Co",
4980243,Direct bonding of ceramic parts by a silver alloy solder,
4980127,Oxidation resistant titanium-base alloy,
4980123,"Process for obtaining a metallurgical bond between a metal material, or a composite material having a metal matrix, and a metal cast piece or a metal-alloy cast piece",
4980035,Bath for electrolytic deposition of a gold-copper-zinc alloy,
4979995,Member made of nickel base alloy having high resistance to stress corrosion cracking and method of producing same,
4978601,Lead alloy battery grids by laser treatment,
4977575,Adjustable aperture comprising a shape memory alloy and laser using same,
4977043,Rectangular sealed alkaline storage battery with negative electrode comprising hydrogen storage alloy,
4976917,Method of manufacturing hardwearing aluminum alloy part,
4976916,Method for producing ferrous sintered alloy product,
4976791,Heat resistant single crystal nickel-base super alloy,
4976790,Process for preparing low earing aluminum alloy strip,
4975335,Fe-Mn-Al-C based alloy articles and parts and their treatments,
4975244,Non-ferrous soft soldering lead-tin-antimony alloy compositions,
4975243,Aluminum alloy suitable for pistons,
4975125,Titanium alpha-beta alloy fabricated material and process for preparation,
4973609,Porous fluoropolymer alloy and process of manufacture,
4973522,Aluminum alloy composites,
4973446,Silver alloy compositions,
4973393,Surface-treated magnesium or magnesium-alloy and process for surface treatment of magnesium or magnesium alloy,
4973390,Process and apparatus for producing lithium from aluminum-lithium alloy scrap in a three-layered lithium transport cell,
4973369,Alloy catalyst for oxidation of hydrogen,
4973363,Aluminum alloy and method for making same,
4973024,Valve driven by shape memory alloy,
4972285,Amorphous magnetic alloy of Co-Nb-Zr system and magnetic head made from the same,
4971758,Copper-based alloy connector for electrical devices,
4971756,Method for producing dies for use in compacting permanent magnet alloy powders,
4971003,Piston of aluminum alloy for internal combustion engines,
4970179,Molybdenum disilicide alloy matrix composite,
4970128,Supported platinum alloy electrocatalyst,
4969980,Process for electroplating stainless steel strips with zinc or zinc-nickel alloy,
4969961,Sm-Fe-V magnet alloy and method of making same,
4969428,Hypereutectic aluminum silicon alloy,
4968482,Uranium-titanium-niobium alloy,
4968357,Hot-rolled alloy steel plate and the method of making,
4968356,Method of producing hardened aluminum alloy forming sheet having high strength and superior corrosion resistance,
4968348,Titanium diboride/titanium alloy metal matrix microcomposite material and process for powder metal cladding,
4966820,Ceramics-coated heat resisting alloy member,
4966662,Process for preparing praseodynium metal or praseodymium-containing alloy,
4966661,Process for preparation of neodymium or neodymium alloy,
4966636,Two-phase high damping capacity F3-Mn-Al-C based alloy,
4966626,Sintered ferro alloy having heat and wear resistance and process for making,
4966221,Method of producing aluminum alloy castings and piston made of aluminum alloy,
4966220,Evaporable foam casting system utilizing a hypereutectic aluminum-silicon alloy,
4965545,Shape memory alloy rotary actuator,
4965245,Method of producing oxide superconducting cables and coils using copper alloy filament precursors,
4965046,Creep resistant zinc-aluminum based casting alloy,
4965045,"Copper-based alloy for obtaining aluminum-beta-brasses, containing grain size reducing additives of titanium and niobium",
4964967,Surface activated alloy electrodes and process for preparing them,
4964925,Medical implant made of a stainless steel alloy,
4963440,Al-Cr alloy vapor-deposited material,
4963439,Continuous fiber-reinforced Al-Co alloy matrix composite,
4963323,Highly corrosion-resistant zirconium alloy for use as nuclear reactor fuel cladding material,
4963322,Process for the production of good fatigue strength aluminum alloy components,
4963321,Surface refined sintered alloy and process for producing the same and coated surface refined sintered alloy comprising rigid film coated on the alloy,
4963240,Sputtering alloy target and method of producing an alloy film,
4962880,Method of forming a heat exchanger with components comprising an aluminum alloy containing reduced amounts of magnesium,
4962085,Production of oxidic superconductors by zone oxidation of a precursor alloy,
4962007,Flute tubing of laminated metal including a bonded layer of precious metal alloy,
4962003,Development of fusible alloy composites,
4961781,High corrosion-and wear resistant-powder sintered alloy and composite products,
4960680,Recording elements comprising write-once thin film alloy layers,
4960564,Pyrophoric alloy complexes,
4959279,Superconducting wire containing multifilamentary superconducting alloy,
4959278,Tin whisker-free tin or tin alloy plated article and coating technique thereof,
4959276,"Heat-resistant, wear-resistant and high-strength Al-Si alloy, and cylinder liner employing same",
4959274,Multilayered iron-copper-lead alloy bearing material,
4959195,Method of forming large-sized aluminum alloy product,
4959194,High strength uranium-tungsten alloy process,
4959136,Method for making an amorphous aluminum-nitrogen alloy layer,
4958569,Wrought copper alloy-shaped charge liner,
4958431,"More creep resistant turbine rotor, and procedures for repair welding of low alloy ferrous turbine components",
4957653,"Composition containing alkane sulfonic acid and ferric nitrate for stripping tin or tin-lead alloy from copper surfaces, and method for stripping tin or tin-lead alloy",
4957594,Process for producing a zinc or zinc alloy coated steel sheet having excellent spot weldability,
4957567,Fatigue crack growth resistant nickel-base article and alloy and method for making,
4957549,"Rare earth metal-iron group metal target, alloy powder therefor and method of producing same",
4957548,Cermet alloy,
4957236,Method of brazing parts of Ti-Al-Nb alloy,
4956144,Hafnium containing Nb-Ti-Al high temperature alloy,
4956011,Iron-silicon alloy powder magnetic cores and method of manufacturing the same,
4956009,Calcium alloy steel additive and method thereof,
4955413,"A alloy product containing Li, resistance to corrosion under stress, and process to obtain said product",
4954188,High strength aluminum alloy resistant to exfoliation and method of making,
4954187,Precipitates copper-zinc alloy with nickel silicide,
4954171,Composite alloy steel powder and sintered alloy steel,
4953275,Process for manufacturing alloy wheels for vehicle tires,
4953050,Magnetic head with Ru containing soft magnetic alloy in gap,
4952686,Soluble dried cassia alloy gum composition and process for making same,
4952236,"Method of making high strength, low modulus, ductile, biocompatible titanium alloy",
4950560,Aluminum alloy and associated anode and battery,
4950451,Copper alloy for an electronic device and method of preparing the same,
4950340,Intermetallic compound type alloy having improved toughness machinability and wear resistance,
4950331,Ceramic flux for welding low-alloy steels,
4950328,End mill formed of tungsten carbide-base sintered hard alloy,
4950327,Creep-resistant alloy of high-melting metal and process for producing the same,
4948559,Alloy for building up valve,
4948557,Tarnish resistant gold colored alloy with enhanced gold color,
4948434,Method for manufacturing Ni-Fe alloy sheet having excellent DC magnetic property and excellent AC magnetic property,
4948423,Alloy preparation of hydrogen storage materials,
4946906,Process for producing polyoxymethylene-polyurethane type alloy,
4946646,Alloy for hydrogen storage electrodes,
4946501,Alloy target for magneto-optical recording,
4945750,Press forging of molybdenum or molybdenum alloy parts,
4945727,Hydraulic shape memory alloy actuator,
4944914,Titanium base alloy for superplastic forming,
4944851,Electrolytic method for regenerating tin or tin-lead alloy stripping compositions,
4944814,Aluminum-manganese-iron steel alloy,
4944801,"Process for preparing powder of an alloy of a rare earth element, iron and boron for a resin bonded magnet",
4943883,Quarternary amorphous magnetic alloy thin film and magnetic head including same,
4943483,"Palladium alloy containing gold, silver, gallium, germanium and/or lithium and dental restorations utilizing same",
4943453,"Method and coloration of parts taken among parts made of zinc, coated with zinc and made of zinc containing alloy",
4943413,Process for producing an aluminum/magnesium alloy,
4943412,High strength alpha-beta titanium-base alloy,
4943321,Synchronizer ring in speed variator made of iron-base sintered alloy,
4942998,Apparatus and process for automatically dispensing metal alloy paste material for joining metal components,
4940639,Zn-Ni alloy-plated steel sheet with improved impact adhesion,
4940566,Alloy and methods of use thereof,
4940390,Turbine system having more failure resistant rotors and repair welding of low alloy ferrous turbine components by controlled weld build-up,
4939610,Thin film magnetic head having magnetic core including a thin film of cobalt alloy,
4939316,Aluminum alloy semiconductor packages,
4939044,Aluminum alloy support for lithographic printing plate,
4938922,Gold-nickel-titanium brazing alloy,
4938921,Method of manufacturing a zirconium-based alloy tube for a nuclear fuel element sheath and tube thereof,
4938810,"Heat-resistant, wear-resistant, and high-strength aluminum alloy powder and body shaped therefrom",
4938809,"Superplastic forming consolidated rapidly solidified, magnestum base metal alloy powder",
4938276,Method and apparatus for supplying a lead alloy to a casting machine,
4937149,"Overlay alloy used for a surface layer of sliding material, sliding material having a surface layer comprising said alloy and the manufacturing method of the sliding material",
4937044,Strontium-magnesium-aluminum master alloy,
4937043,Boron alloy,
4936929,Refractory amorphous Co-Ta-Hf alloy,
4936927,Method for applying an aluminum diffusion coating to a component of titanium alloy,
4936925,Method for producing alloy of low thermal expansion,
4936270,Composite light alloy member,
4935203,Corrosion resistant aluminum alloy,
4935201,"Ferromagnetic Ni-Fe alloy, and method for manufacturing alloy article having excellent surface quality of said alloy",
4935076,Copper alloy for use as material of heat exchanger,
4935069,Method for working nickel-base alloy,
4935068,Method of treating a sample of an alloy,
4934313,Control of uniformity of growing alloy film,
4933027,"Iron-based shape-memory alloy excellent in shape-memory property, corrosion resistance and high-temperature oxidation resistance",
4933008,Heat resistant and wear resistant iron-based sintered alloy,
4933003,Metal alloy formation by reduction of polyheterometallic complexes,
4931845,Semiconductor memory device having an ohmic contact between an aluminum-silicon alloy metallization film and a silicon substrate,
4931254,Nb-Ti-Al-Hf-Cr alloy,
4931253,Method for producing alpha titanium alloy pm articles,
4930566,Method for continuous casting of an aluminum-lithium alloy,
4930494,Apparatus for bending an insertion section of an endoscope using a shape memory alloy,
4930001,Alloy bonded indium bumps and methods of processing same,
4929423,Low toxicity alloy compositions for joining and sealing,
4929420,Alloy useful particularly in dentistry,
4929419,"Heat, corrosion, and wear resistant steel alloy and article",
